{
  "$schema": "https://json-schema.org/draft/2020-12/schema",
  "type": "object", "additionalProperties": false,
  "required": ["schema_version", "manifest_id", "run_id", "attempt_id", "created_at", "research_cutoff", "source", "capability_id", "discovery_status", "availability_status", "qualification", "admissibility", "status", "degradation_reason", "datasets", "content_digest"],
  "properties": {
    "schema_version": {"const": "1.0"}, "manifest_id": {"type":"string","minLength":1}, "run_id":{"type":"string","minLength":1}, "attempt_id":{"type":"string","minLength":1}, "created_at":{"type":"string","format":"date-time"}, "research_cutoff":{"type":"string","format":"date-time"},
    "source":{"type":"object","additionalProperties":false,"required":["source_id","identity_digest","provider","runtime","transport","adapter_id","adapter_version","capability_ids"],"properties":{"source_id":{"type":"string","minLength":1},"identity_digest":{"type":"string","pattern":"^sha256:[0-9a-f]{64}$"},"provider":{"type":"string","minLength":1},"runtime":{"type":"string","minLength":1},"transport":{"type":"string","minLength":1},"adapter_id":{"type":"string","minLength":1},"adapter_version":{"type":"string","minLength":1},"capability_ids":{"type":"array","minItems":1,"items":{"type":"string"},"uniqueItems":true}}},
    "capability_id":{"type":"string","minLength":1}, "discovery_status":{"enum":["DISCOVERED","NOT_DISCOVERED","UNKNOWN"]}, "availability_status":{"enum":["AVAILABLE","UNAVAILABLE","UNKNOWN"]}, "qualification":{"enum":["QUALIFIED","UNQUALIFIED","EXPIRED"]}, "admissibility":{"enum":["ADMITTED","NOT_ADMITTED"]}, "status":{"enum":["COMPLETE","DEGRADED","PARTIAL","BLOCKED","UNAVAILABLE"]}, "degradation_reason":{"type":["string","null"]}, "adapter_payload":{"type":"object"},
    "datasets":{"type":"array","items":{"type":"object","additionalProperties":false,"required":["dataset_id","data_digest","evidence_role","status","pagination_complete","row_count","observed_at","freshness_seconds","max_age_seconds","qualification","admissibility"],"properties":{"dataset_id":{"type":"string","minLength":1},"data_digest":{"type":"string","pattern":"^sha256:[0-9a-f]{64}$"},"evidence_role":{"enum":["RESEARCH_INPUT","DIAGNOSTIC"]},"status":{"enum":["COMPLETE","DEGRADED","PARTIAL","BLOCKED","UNAVAILABLE"]},"pagination_complete":{"type":"boolean"},"row_count":{"type":"integer","minimum":0},"observed_at":{"type":"string","format":"date-time"},"published_at":{"type":["string","null"]},"available_at":{"type":["string","null"]},"freshness_seconds":{"type":"integer","minimum":0},"max_age_seconds":{"type":"integer","minimum":0},"qualification":{"enum":["QUALIFIED","UNQUALIFIED","EXPIRED"]},"admissibility":{"enum":["ADMITTED","NOT_ADMITTED"]},"rights_result":{"enum":["PASS","BLOCK","UNKNOWN"]},"rights_snapshot_id":{"type":"string","minLength":1},"rights_snapshot_digest":{"type":"string","pattern":"^sha256:[0-9a-f]{64}$"}} ,"allOf":[{"if":{"properties":{"evidence_role":{"const":"RESEARCH_INPUT"}},"required":["evidence_role"]},"then":{"required":["rights_result","rights_snapshot_id","rights_snapshot_digest"],"properties":{"rights_result":{"const":"PASS"}}}}]}}, "content_digest":{"type":"string","pattern":"^sha256:[0-9a-f]{64}$"}
  }
}
