{
  "adapter_payload": {
    "deployment_id": "dep-datvbjflk1mc73d3pitg",
    "endpoint_url": "https://fin-data-mcp-http-v02-prod.onrender.com/mcp",
    "normalization_version": "fin-data-native-envelope-v1",
    "normalized_file_digest": "sha256:5caeb9ac04c6cbcfeb0dd39a3d8850728d1d1b58e2e73e9679639b2acb2ed57c",
    "normalized_path": "fin_crypto_open_interest.normalized.jsonl",
    "normalized_rows_digest": "sha256:60728c44329e99ae2b735d4ee54d152b4b7de5857b4afb35bbcdb680b767b97b",
    "raw_file_digest": "sha256:f10e554cf8de127409f762aad51c8e546d97ae8feea4757cce784608b4caee9e",
    "raw_path": "fin_crypto_open_interest.raw.json",
    "raw_response_digest": "sha256:f10e554cf8de127409f762aad51c8e546d97ae8feea4757cce784608b4caee9e"
  },
  "admissibility": "NOT_ADMITTED",
  "attempt_id": "fin-data-prod-probe-2026-09-30-v2",
  "availability_status": "AVAILABLE",
  "capability_id": "fin.crypto.open_interest",
  "content_digest": "sha256:f35381d7894624ba1d94b6777594cd23c5f98d372daf58d17ac6fc296b392c71",
  "created_at": "2026-09-30T03:15:33Z",
  "datasets": [
    {
      "admissibility": "NOT_ADMITTED",
      "available_at": "2026-09-30T03:15:33Z",
      "data_digest": "sha256:60728c44329e99ae2b735d4ee54d152b4b7de5857b4afb35bbcdb680b767b97b",
      "dataset_id": "fin.crypto.open_interest:fin-data-prod-probe-2026-09-30-v2",
      "evidence_role": "DIAGNOSTIC",
      "freshness_seconds": 74698,
      "max_age_seconds": 600,
      "observed_at": "2026-09-30T03:15:01.438000Z",
      "pagination_complete": true,
      "published_at": null,
      "qualification": "UNQUALIFIED",
      "row_count": 1,
      "status": "DEGRADED"
    }
  ],
  "degradation_reason": "fin_data_capability_not_qualified",
  "discovery_status": "DISCOVERED",
  "manifest_id": "sm-9f1169e576ed53500ea01361",
  "qualification": "UNQUALIFIED",
  "research_cutoff": "2026-10-01T00:00:00Z",
  "run_id": "2026-09-30-eod",
  "schema_version": "1.0",
  "source": {
    "adapter_id": "fin_data_mcp",
    "adapter_version": "0.1.0",
    "capability_ids": [
      "fin.crypto.instrument_discovery",
      "fin.crypto.funding",
      "fin.crypto.open_interest",
      "fin.crypto.long_short_ratio",
      "fin.crypto.mark_price",
      "fin.crypto.ticker",
      "fin.crypto.orderbook",
      "fin.crypto.recent_trades",
      "fin.crypto.candles",
      "fin.crypto.index_candles"
    ],
    "identity_digest": "sha256:8aa8fd9ae616769286e1646944fbd519c6d2aeeeb392707723e85e20c3aec379",
    "provider": "CohenD/fin-data-mcp",
    "runtime": "https://fin-data-mcp-http-v02-prod.onrender.com/mcp",
    "source_id": "fin_data_mcp_render_prod",
    "transport": "streamable_http"
  },
  "status": "DEGRADED"
}
