{
  "adapter_payload": {
    "deployment_id": "dep-datvbjflk1mc73d3pitg",
    "endpoint_url": "https://fin-data-mcp-http-v02-prod.onrender.com/mcp",
    "normalization_version": "fin-data-native-envelope-v1",
    "normalized_file_digest": "sha256:2f7fab3ff1022d32401fb70b5b11f8ab20878fc3745d0ba946e619ed8dad46ad",
    "normalized_path": "fin_crypto_index_candles.normalized.jsonl",
    "normalized_rows_digest": "sha256:1eb0394d75e77ec1212be85a3410915a1c5473d305a0ad8e27f150dc70593295",
    "raw_file_digest": "sha256:ec9dddbfb8113c155fec71cb724c5279278f4c098e59823801a0a0f84ab7979e",
    "raw_path": "fin_crypto_index_candles.raw.json",
    "raw_response_digest": "sha256:ec9dddbfb8113c155fec71cb724c5279278f4c098e59823801a0a0f84ab7979e"
  },
  "admissibility": "NOT_ADMITTED",
  "attempt_id": "fin-data-prod-probe-2026-09-30",
  "availability_status": "AVAILABLE",
  "capability_id": "fin.crypto.index_candles",
  "content_digest": "sha256:6507f47057178a9461081dd4ac008a2994146e38e72a2c86a43b01209a30a149",
  "created_at": "2026-09-30T02:56:39Z",
  "datasets": [
    {
      "admissibility": "NOT_ADMITTED",
      "available_at": "2026-09-30T02:56:39Z",
      "data_digest": "sha256:1eb0394d75e77ec1212be85a3410915a1c5473d305a0ad8e27f150dc70593295",
      "dataset_id": "fin.crypto.index_candles:fin-data-prod-probe-2026-09-30",
      "evidence_role": "DIAGNOSTIC",
      "freshness_seconds": 79200,
      "max_age_seconds": 7200,
      "observed_at": "2026-09-30T02:00:00Z",
      "pagination_complete": true,
      "published_at": null,
      "qualification": "UNQUALIFIED",
      "row_count": 1,
      "status": "DEGRADED"
    }
  ],
  "degradation_reason": "fin_data_capability_not_qualified",
  "discovery_status": "DISCOVERED",
  "manifest_id": "sm-58d646b07dd03fe905acb0ae",
  "qualification": "UNQUALIFIED",
  "research_cutoff": "2026-10-01T00:00:00Z",
  "run_id": "2026-09-30-eod",
  "schema_version": "1.0",
  "source": {
    "adapter_id": "fin_data_mcp",
    "adapter_version": "0.1.0",
    "capability_ids": [
      "fin.crypto.instrument_discovery",
      "fin.crypto.funding",
      "fin.crypto.open_interest",
      "fin.crypto.long_short_ratio",
      "fin.crypto.mark_price",
      "fin.crypto.ticker",
      "fin.crypto.orderbook",
      "fin.crypto.recent_trades",
      "fin.crypto.candles",
      "fin.crypto.index_candles"
    ],
    "identity_digest": "sha256:8aa8fd9ae616769286e1646944fbd519c6d2aeeeb392707723e85e20c3aec379",
    "provider": "CohenD/fin-data-mcp",
    "runtime": "https://fin-data-mcp-http-v02-prod.onrender.com/mcp",
    "source_id": "fin_data_mcp_render_prod",
    "transport": "streamable_http"
  },
  "status": "DEGRADED"
}
