{
  "adapter_payload": {
    "deployment_id": "dep-datvbjflk1mc73d3pitg",
    "endpoint_url": "https://fin-data-mcp-http-v02-prod.onrender.com/mcp",
    "normalization_version": "fin-data-native-envelope-v1",
    "normalized_file_digest": "sha256:402cd78cf8b25c14b4d115ee9020ede43568e1cb5d996655768e301a45e0c601",
    "normalized_path": "fin_crypto_funding.normalized.jsonl",
    "normalized_rows_digest": "sha256:1e3f341ca9717be1beaf9076d9cd3a8242259ccb4ffffd5b330b4c057f912362",
    "raw_file_digest": "sha256:81ef16e75482fc0d52387e426e1147b8bf747e023705d8bf0be1e749de920dbd",
    "raw_path": "fin_crypto_funding.raw.json",
    "raw_response_digest": "sha256:81ef16e75482fc0d52387e426e1147b8bf747e023705d8bf0be1e749de920dbd"
  },
  "admissibility": "NOT_ADMITTED",
  "attempt_id": "fin-data-prod-probe-2026-09-30",
  "availability_status": "AVAILABLE",
  "capability_id": "fin.crypto.funding",
  "content_digest": "sha256:7f9a9b4654d953d2e572257f309db90a854948dc0acf63096305257b23256984",
  "created_at": "2026-09-30T02:56:39Z",
  "datasets": [
    {
      "admissibility": "NOT_ADMITTED",
      "available_at": "2026-09-30T02:56:39Z",
      "data_digest": "sha256:1e3f341ca9717be1beaf9076d9cd3a8242259ccb4ffffd5b330b4c057f912362",
      "dataset_id": "fin.crypto.funding:fin-data-prod-probe-2026-09-30",
      "evidence_role": "DIAGNOSTIC",
      "freshness_seconds": 76737,
      "max_age_seconds": 3600,
      "observed_at": "2026-09-30T02:41:02.974000Z",
      "pagination_complete": true,
      "published_at": null,
      "qualification": "UNQUALIFIED",
      "row_count": 1,
      "status": "DEGRADED"
    }
  ],
  "degradation_reason": "fin_data_capability_not_qualified",
  "discovery_status": "DISCOVERED",
  "manifest_id": "sm-35316a7dbc6faaf8edbac01d",
  "qualification": "UNQUALIFIED",
  "research_cutoff": "2026-10-01T00:00:00Z",
  "run_id": "2026-09-30-eod",
  "schema_version": "1.0",
  "source": {
    "adapter_id": "fin_data_mcp",
    "adapter_version": "0.1.0",
    "capability_ids": [
      "fin.crypto.instrument_discovery",
      "fin.crypto.funding",
      "fin.crypto.open_interest",
      "fin.crypto.long_short_ratio",
      "fin.crypto.mark_price",
      "fin.crypto.ticker",
      "fin.crypto.orderbook",
      "fin.crypto.recent_trades",
      "fin.crypto.candles",
      "fin.crypto.index_candles"
    ],
    "identity_digest": "sha256:8aa8fd9ae616769286e1646944fbd519c6d2aeeeb392707723e85e20c3aec379",
    "provider": "CohenD/fin-data-mcp",
    "runtime": "https://fin-data-mcp-http-v02-prod.onrender.com/mcp",
    "source_id": "fin_data_mcp_render_prod",
    "transport": "streamable_http"
  },
  "status": "DEGRADED"
}
