{
  "adapter_payload": {
    "deployment_id": "dep-datvbjflk1mc73d3pitg",
    "endpoint_url": "https://fin-data-mcp-http-v02-prod.onrender.com/mcp",
    "normalization_version": "fin-data-native-envelope-v1",
    "normalized_file_digest": "sha256:65cda3869dd25c5bcbff2258af90e09d4d898ded30bc31bcba5a218aacdaa0bc",
    "normalized_path": "fin_crypto_funding.normalized.jsonl",
    "normalized_rows_digest": "sha256:f9dd9dee4c284e935dbb88580996d7ed1bc503ec30755d1ccf49b4732ec3a150",
    "raw_file_digest": "sha256:3219ed7b41018d3e483a6ff5d226870f1abb9ee30b1606ae8f1ce828588cc26d",
    "raw_path": "fin_crypto_funding.raw.json",
    "raw_response_digest": "sha256:3219ed7b41018d3e483a6ff5d226870f1abb9ee30b1606ae8f1ce828588cc26d"
  },
  "admissibility": "NOT_ADMITTED",
  "attempt_id": "fin-data-prod-probe-2026-09-30-v2",
  "availability_status": "AVAILABLE",
  "capability_id": "fin.crypto.funding",
  "content_digest": "sha256:eef83152399640b2d83d87d689e5d62eba59f909ba3325eb25ecaed8feda596b",
  "created_at": "2026-09-30T03:15:33Z",
  "datasets": [
    {
      "admissibility": "NOT_ADMITTED",
      "available_at": "2026-09-30T03:15:33Z",
      "data_digest": "sha256:f9dd9dee4c284e935dbb88580996d7ed1bc503ec30755d1ccf49b4732ec3a150",
      "dataset_id": "fin.crypto.funding:fin-data-prod-probe-2026-09-30-v2",
      "evidence_role": "DIAGNOSTIC",
      "freshness_seconds": 74756,
      "max_age_seconds": 3600,
      "observed_at": "2026-09-30T03:14:03.059000Z",
      "pagination_complete": true,
      "published_at": null,
      "qualification": "UNQUALIFIED",
      "row_count": 1,
      "status": "DEGRADED"
    }
  ],
  "degradation_reason": "fin_data_capability_not_qualified",
  "discovery_status": "DISCOVERED",
  "manifest_id": "sm-1ad4a78c39a749108bd2bfb7",
  "qualification": "UNQUALIFIED",
  "research_cutoff": "2026-10-01T00:00:00Z",
  "run_id": "2026-09-30-eod",
  "schema_version": "1.0",
  "source": {
    "adapter_id": "fin_data_mcp",
    "adapter_version": "0.1.0",
    "capability_ids": [
      "fin.crypto.instrument_discovery",
      "fin.crypto.funding",
      "fin.crypto.open_interest",
      "fin.crypto.long_short_ratio",
      "fin.crypto.mark_price",
      "fin.crypto.ticker",
      "fin.crypto.orderbook",
      "fin.crypto.recent_trades",
      "fin.crypto.candles",
      "fin.crypto.index_candles"
    ],
    "identity_digest": "sha256:8aa8fd9ae616769286e1646944fbd519c6d2aeeeb392707723e85e20c3aec379",
    "provider": "CohenD/fin-data-mcp",
    "runtime": "https://fin-data-mcp-http-v02-prod.onrender.com/mcp",
    "source_id": "fin_data_mcp_render_prod",
    "transport": "streamable_http"
  },
  "status": "DEGRADED"
}
