{
  "adapter_payload": {
    "deployment_id": "dep-datvbjflk1mc73d3pitg",
    "endpoint_url": "https://fin-data-mcp-http-v02-prod.onrender.com/mcp",
    "normalization_version": "fin-data-native-envelope-v1",
    "normalized_file_digest": "sha256:e6240b2011b7ab13f23317abd249541ef45e0c15865159ef2a6ddf11544d1088",
    "normalized_path": "fin_crypto_ticker.normalized.jsonl",
    "normalized_rows_digest": "sha256:d2d96e711d81031f0d52cff2d1582043c35061de730a9fa246c3ba7b8f78d680",
    "raw_file_digest": "sha256:7098a1ca3da70d6d38c5fbd9831ad09f7f1519e955d0a17a7f802a78e733e42b",
    "raw_path": "fin_crypto_ticker.raw.json",
    "raw_response_digest": "sha256:7098a1ca3da70d6d38c5fbd9831ad09f7f1519e955d0a17a7f802a78e733e42b"
  },
  "admissibility": "NOT_ADMITTED",
  "attempt_id": "fin-data-prod-probe-2026-09-30-v2",
  "availability_status": "AVAILABLE",
  "capability_id": "fin.crypto.ticker",
  "content_digest": "sha256:f1fa41bd33d15ab9008f3c3e2b7fff3581ed17f30932c2e270f233a449744c37",
  "created_at": "2026-09-30T03:15:33Z",
  "datasets": [
    {
      "admissibility": "NOT_ADMITTED",
      "available_at": "2026-09-30T03:15:33Z",
      "data_digest": "sha256:d2d96e711d81031f0d52cff2d1582043c35061de730a9fa246c3ba7b8f78d680",
      "dataset_id": "fin.crypto.ticker:fin-data-prod-probe-2026-09-30-v2",
      "evidence_role": "DIAGNOSTIC",
      "freshness_seconds": 74687,
      "max_age_seconds": 600,
      "observed_at": "2026-09-30T03:15:12.664000Z",
      "pagination_complete": true,
      "published_at": null,
      "qualification": "UNQUALIFIED",
      "row_count": 1,
      "status": "DEGRADED"
    }
  ],
  "degradation_reason": "fin_data_capability_not_qualified",
  "discovery_status": "DISCOVERED",
  "manifest_id": "sm-3e63755512cd5bd1d2823249",
  "qualification": "UNQUALIFIED",
  "research_cutoff": "2026-10-01T00:00:00Z",
  "run_id": "2026-09-30-eod",
  "schema_version": "1.0",
  "source": {
    "adapter_id": "fin_data_mcp",
    "adapter_version": "0.1.0",
    "capability_ids": [
      "fin.crypto.instrument_discovery",
      "fin.crypto.funding",
      "fin.crypto.open_interest",
      "fin.crypto.long_short_ratio",
      "fin.crypto.mark_price",
      "fin.crypto.ticker",
      "fin.crypto.orderbook",
      "fin.crypto.recent_trades",
      "fin.crypto.candles",
      "fin.crypto.index_candles"
    ],
    "identity_digest": "sha256:8aa8fd9ae616769286e1646944fbd519c6d2aeeeb392707723e85e20c3aec379",
    "provider": "CohenD/fin-data-mcp",
    "runtime": "https://fin-data-mcp-http-v02-prod.onrender.com/mcp",
    "source_id": "fin_data_mcp_render_prod",
    "transport": "streamable_http"
  },
  "status": "DEGRADED"
}
