{
  "adapter_payload": {
    "deployment_id": "dep-datvbjflk1mc73d3pitg",
    "endpoint_url": "https://fin-data-mcp-http-v02-prod.onrender.com/mcp",
    "normalization_version": "fin-data-native-envelope-v1",
    "normalized_file_digest": "sha256:7ccff56ac4d0f2ee3f0dcecc3d4d89594a7340e048b65a406bc673a08e445bc8",
    "normalized_path": "fin_crypto_long_short_ratio.normalized.jsonl",
    "normalized_rows_digest": "sha256:5aa875bea64b0c9cf0f2ec1c93ab47ff40cec1e48560eecbab51868a43abb8cb",
    "raw_file_digest": "sha256:ed0355a474797e36557e8e2bad72dbe0b438f299b3e931386af9e54329a02042",
    "raw_path": "fin_crypto_long_short_ratio.raw.json",
    "raw_response_digest": "sha256:ed0355a474797e36557e8e2bad72dbe0b438f299b3e931386af9e54329a02042"
  },
  "admissibility": "NOT_ADMITTED",
  "attempt_id": "fin-data-prod-probe-2026-09-30",
  "availability_status": "AVAILABLE",
  "capability_id": "fin.crypto.long_short_ratio",
  "content_digest": "sha256:37c2b85084595e0f97f44742b2ecad6e6386d254ff74f9048c51cae1d28a5f0f",
  "created_at": "2026-09-30T02:56:39Z",
  "datasets": [
    {
      "admissibility": "NOT_ADMITTED",
      "available_at": "2026-09-30T02:56:39Z",
      "data_digest": "sha256:5aa875bea64b0c9cf0f2ec1c93ab47ff40cec1e48560eecbab51868a43abb8cb",
      "dataset_id": "fin.crypto.long_short_ratio:fin-data-prod-probe-2026-09-30",
      "evidence_role": "DIAGNOSTIC",
      "freshness_seconds": 76800,
      "max_age_seconds": 600,
      "observed_at": "2026-09-30T02:40:00Z",
      "pagination_complete": true,
      "published_at": null,
      "qualification": "UNQUALIFIED",
      "row_count": 576,
      "status": "DEGRADED"
    }
  ],
  "degradation_reason": "fin_data_capability_not_qualified",
  "discovery_status": "DISCOVERED",
  "manifest_id": "sm-ecef7615d7d764671f7f93e2",
  "qualification": "UNQUALIFIED",
  "research_cutoff": "2026-10-01T00:00:00Z",
  "run_id": "2026-09-30-eod",
  "schema_version": "1.0",
  "source": {
    "adapter_id": "fin_data_mcp",
    "adapter_version": "0.1.0",
    "capability_ids": [
      "fin.crypto.instrument_discovery",
      "fin.crypto.funding",
      "fin.crypto.open_interest",
      "fin.crypto.long_short_ratio",
      "fin.crypto.mark_price",
      "fin.crypto.ticker",
      "fin.crypto.orderbook",
      "fin.crypto.recent_trades",
      "fin.crypto.candles",
      "fin.crypto.index_candles"
    ],
    "identity_digest": "sha256:8aa8fd9ae616769286e1646944fbd519c6d2aeeeb392707723e85e20c3aec379",
    "provider": "CohenD/fin-data-mcp",
    "runtime": "https://fin-data-mcp-http-v02-prod.onrender.com/mcp",
    "source_id": "fin_data_mcp_render_prod",
    "transport": "streamable_http"
  },
  "status": "DEGRADED"
}
