{
  "adapter_payload": {
    "deployment_id": "dep-datvbjflk1mc73d3pitg",
    "endpoint_url": "https://fin-data-mcp-http-v02-prod.onrender.com/mcp",
    "normalization_version": "fin-data-native-envelope-v1",
    "normalized_file_digest": "sha256:8a27f3b3f281d46603fb5aab3570113edd85c7ac162f4ca31ed89475485dc169",
    "normalized_path": "fin_crypto_recent_trades.normalized.jsonl",
    "normalized_rows_digest": "sha256:4285492b3e7cef9cee8b809c294c0b40b35edb5e52a27f36022966248d7738e7",
    "raw_file_digest": "sha256:14f17fb81e5c48aa486e3d7c0dea6670b70f2156adf1a4f1cac06ee1340d5d87",
    "raw_path": "fin_crypto_recent_trades.raw.json",
    "raw_response_digest": "sha256:14f17fb81e5c48aa486e3d7c0dea6670b70f2156adf1a4f1cac06ee1340d5d87"
  },
  "admissibility": "NOT_ADMITTED",
  "attempt_id": "fin-data-prod-probe-2026-09-30",
  "availability_status": "AVAILABLE",
  "capability_id": "fin.crypto.recent_trades",
  "content_digest": "sha256:8e1610afb032d43048a9596d6b32f65347cbc089b28dc483ce02955c4e550c27",
  "created_at": "2026-09-30T02:56:39Z",
  "datasets": [
    {
      "admissibility": "NOT_ADMITTED",
      "available_at": "2026-09-30T02:56:39Z",
      "data_digest": "sha256:4285492b3e7cef9cee8b809c294c0b40b35edb5e52a27f36022966248d7738e7",
      "dataset_id": "fin.crypto.recent_trades:fin-data-prod-probe-2026-09-30",
      "evidence_role": "DIAGNOSTIC",
      "freshness_seconds": 76594,
      "max_age_seconds": 600,
      "observed_at": "2026-09-30T02:43:25.591000Z",
      "pagination_complete": true,
      "published_at": null,
      "qualification": "UNQUALIFIED",
      "row_count": 10,
      "status": "DEGRADED"
    }
  ],
  "degradation_reason": "fin_data_capability_not_qualified",
  "discovery_status": "DISCOVERED",
  "manifest_id": "sm-b75f40295cd8d2e94cf3c705",
  "qualification": "UNQUALIFIED",
  "research_cutoff": "2026-10-01T00:00:00Z",
  "run_id": "2026-09-30-eod",
  "schema_version": "1.0",
  "source": {
    "adapter_id": "fin_data_mcp",
    "adapter_version": "0.1.0",
    "capability_ids": [
      "fin.crypto.instrument_discovery",
      "fin.crypto.funding",
      "fin.crypto.open_interest",
      "fin.crypto.long_short_ratio",
      "fin.crypto.mark_price",
      "fin.crypto.ticker",
      "fin.crypto.orderbook",
      "fin.crypto.recent_trades",
      "fin.crypto.candles",
      "fin.crypto.index_candles"
    ],
    "identity_digest": "sha256:8aa8fd9ae616769286e1646944fbd519c6d2aeeeb392707723e85e20c3aec379",
    "provider": "CohenD/fin-data-mcp",
    "runtime": "https://fin-data-mcp-http-v02-prod.onrender.com/mcp",
    "source_id": "fin_data_mcp_render_prod",
    "transport": "streamable_http"
  },
  "status": "DEGRADED"
}
