{
  "adapter_payload": {
    "deployment_id": "dep-datvbjflk1mc73d3pitg",
    "endpoint_url": "https://fin-data-mcp-http-v02-prod.onrender.com/mcp",
    "normalization_version": "fin-data-native-envelope-v1",
    "normalized_file_digest": "sha256:cd44ceb71eff1598a848341d2140ff86f6fcc46762bfe84eab5fe954f7dde36f",
    "normalized_path": "fin_crypto_candles.normalized.jsonl",
    "normalized_rows_digest": "sha256:3713469d883265d9333341127f237562fbaa93415d8abd9d21abd0c136066029",
    "raw_file_digest": "sha256:a3ad0d806e192df1b46333781ff1f8e5f3a2ecdd78864d46626a0f5505c39057",
    "raw_path": "fin_crypto_candles.raw.json",
    "raw_response_digest": "sha256:a3ad0d806e192df1b46333781ff1f8e5f3a2ecdd78864d46626a0f5505c39057"
  },
  "admissibility": "NOT_ADMITTED",
  "attempt_id": "fin-data-prod-probe-2026-09-30-v2",
  "availability_status": "AVAILABLE",
  "capability_id": "fin.crypto.candles",
  "content_digest": "sha256:1ca73dcccc14643df2ece6ea58f5d7e02a717b1e66e76c2e7c391d4d00932168",
  "created_at": "2026-09-30T03:15:33Z",
  "datasets": [
    {
      "admissibility": "NOT_ADMITTED",
      "available_at": "2026-09-30T03:15:33Z",
      "data_digest": "sha256:3713469d883265d9333341127f237562fbaa93415d8abd9d21abd0c136066029",
      "dataset_id": "fin.crypto.candles:fin-data-prod-probe-2026-09-30-v2",
      "evidence_role": "DIAGNOSTIC",
      "freshness_seconds": 75600,
      "max_age_seconds": 7200,
      "observed_at": "2026-09-30T03:00:00Z",
      "pagination_complete": true,
      "published_at": null,
      "qualification": "UNQUALIFIED",
      "row_count": 1,
      "status": "DEGRADED"
    }
  ],
  "degradation_reason": "fin_data_capability_not_qualified",
  "discovery_status": "DISCOVERED",
  "manifest_id": "sm-7f31432546e7d568353e7809",
  "qualification": "UNQUALIFIED",
  "research_cutoff": "2026-10-01T00:00:00Z",
  "run_id": "2026-09-30-eod",
  "schema_version": "1.0",
  "source": {
    "adapter_id": "fin_data_mcp",
    "adapter_version": "0.1.0",
    "capability_ids": [
      "fin.crypto.instrument_discovery",
      "fin.crypto.funding",
      "fin.crypto.open_interest",
      "fin.crypto.long_short_ratio",
      "fin.crypto.mark_price",
      "fin.crypto.ticker",
      "fin.crypto.orderbook",
      "fin.crypto.recent_trades",
      "fin.crypto.candles",
      "fin.crypto.index_candles"
    ],
    "identity_digest": "sha256:8aa8fd9ae616769286e1646944fbd519c6d2aeeeb392707723e85e20c3aec379",
    "provider": "CohenD/fin-data-mcp",
    "runtime": "https://fin-data-mcp-http-v02-prod.onrender.com/mcp",
    "source_id": "fin_data_mcp_render_prod",
    "transport": "streamable_http"
  },
  "status": "DEGRADED"
}
